[
  {
    "id": "vixie-gap-fixed-time-catches-up", "dialect": "vixie", "input": "30 2 * * *", "timezone": "America/New_York",
    "from": "2026-03-07T12:00:00Z", "count": 3,
    "expect": [
      { "at": "2026-03-08T07:00:00Z", "local": "2026-03-08T03:00:00-04:00", "dst": "skipped-adjusted" },
      { "at": "2026-03-09T06:30:00Z", "local": "2026-03-09T02:30:00-04:00" },
      { "at": "2026-03-10T06:30:00Z", "local": "2026-03-10T02:30:00-04:00" }
    ],
    "provenance": { "kind": "derived", "source": "corpus/DERIVATION.md H1, H2" }
  },
  {
    "id": "vixie-gap-wildcard-just-continues", "dialect": "vixie", "input": "*/30 * * * *", "timezone": "America/New_York",
    "from": "2026-03-08T06:00:00Z", "count": 4,
    "expect": [
      { "at": "2026-03-08T06:30:00Z", "local": "2026-03-08T01:30:00-05:00" },
      { "at": "2026-03-08T07:00:00Z", "local": "2026-03-08T03:00:00-04:00" },
      { "at": "2026-03-08T07:30:00Z", "local": "2026-03-08T03:30:00-04:00" },
      { "at": "2026-03-08T08:00:00Z", "local": "2026-03-08T04:00:00-04:00" }
    ],
    "provenance": { "kind": "derived", "source": "corpus/DERIVATION.md H1" }
  },
  {
    "id": "vixie-gap-half-hour-shift", "dialect": "vixie", "input": "15 2 * * *", "timezone": "Australia/Lord_Howe",
    "from": "2026-10-03T00:00:00Z", "count": 2,
    "expect": [
      { "at": "2026-10-03T15:30:00Z", "local": "2026-10-04T02:30:00+11:00", "dst": "skipped-adjusted" },
      { "at": "2026-10-04T15:15:00Z", "local": "2026-10-05T02:15:00+11:00" }
    ],
    "provenance": { "kind": "derived", "source": "corpus/DERIVATION.md H1, H2" }
  },
  {
    "id": "vixie-gap-two-matches-two-catch-up-runs", "dialect": "vixie", "input": "0,30 2 * * *", "timezone": "America/New_York",
    "from": "2026-03-07T12:00:00Z", "count": 3,
    "expect": [
      { "at": "2026-03-08T07:00:00Z", "local": "2026-03-08T03:00:00-04:00", "dst": "skipped-adjusted" },
      { "at": "2026-03-08T07:00:00Z", "local": "2026-03-08T03:00:00-04:00", "dst": "skipped-adjusted" },
      { "at": "2026-03-09T06:00:00Z", "local": "2026-03-09T02:00:00-04:00" }
    ],
    "provenance": { "kind": "derived", "source": "corpus/DERIVATION.md H2" }
  },
  {
    "id": "quartz-gap-skips-the-run", "dialect": "quartz", "input": "0 30 2 * * ?", "timezone": "America/New_York",
    "from": "2026-03-07T12:00:00Z", "count": 2,
    "expect": [
      { "at": "2026-03-09T06:30:00Z", "local": "2026-03-09T02:30:00-04:00" },
      { "at": "2026-03-10T06:30:00Z", "local": "2026-03-10T02:30:00-04:00" }
    ],
    "notMatching": ["2026-03-08T07:00:00Z", "2026-03-08T07:30:00Z"],
    "provenance": { "kind": "derived", "source": "corpus/DERIVATION.md H4" }
  },
  {
    "id": "vixie-overlap-fixed-time-runs-once", "dialect": "vixie", "input": "30 1 * * *", "timezone": "America/New_York",
    "from": "2026-11-01T00:00:00Z", "count": 2,
    "expect": [
      { "at": "2026-11-01T05:30:00Z", "local": "2026-11-01T01:30:00-04:00", "dst": "ambiguous-first" },
      { "at": "2026-11-02T06:30:00Z", "local": "2026-11-02T01:30:00-05:00" }
    ],
    "notMatching": ["2026-11-01T06:30:00Z"],
    "provenance": { "kind": "derived", "source": "corpus/DERIVATION.md H1, H6" }
  },
  {
    "id": "vixie-overlap-wildcard-runs-both-passes", "dialect": "vixie", "input": "*/30 * * * *", "timezone": "America/New_York",
    "from": "2026-11-01T05:00:00Z", "count": 5,
    "expect": [
      { "at": "2026-11-01T05:30:00Z", "local": "2026-11-01T01:30:00-04:00", "dst": "ambiguous-first" },
      { "at": "2026-11-01T06:00:00Z", "local": "2026-11-01T01:00:00-05:00", "dst": "ambiguous-second" },
      { "at": "2026-11-01T06:30:00Z", "local": "2026-11-01T01:30:00-05:00", "dst": "ambiguous-second" },
      { "at": "2026-11-01T07:00:00Z", "local": "2026-11-01T02:00:00-05:00" },
      { "at": "2026-11-01T07:30:00Z", "local": "2026-11-01T02:30:00-05:00" }
    ],
    "provenance": { "kind": "derived", "source": "corpus/DERIVATION.md H1" }
  },
  {
    "id": "quartz-overlap-daily-runs-once-on-second-pass", "dialect": "quartz", "input": "0 30 1 * * ?", "timezone": "America/New_York",
    "from": "2026-11-01T00:00:00Z", "count": 2,
    "expect": [
      { "at": "2026-11-01T06:30:00Z", "local": "2026-11-01T01:30:00-05:00", "dst": "ambiguous-second" },
      { "at": "2026-11-02T06:30:00Z", "local": "2026-11-02T01:30:00-05:00" }
    ],
    "notMatching": ["2026-11-01T05:30:00Z"],
    "provenance": { "kind": "derived", "source": "corpus/DERIVATION.md H6" }
  },
  {
    "id": "quartz-overlap-hourly-runs-once-on-second-pass", "dialect": "quartz", "input": "0 0 * * * ?", "timezone": "America/New_York",
    "from": "2026-11-01T04:30:00Z", "count": 3,
    "expect": [
      { "at": "2026-11-01T06:00:00Z", "local": "2026-11-01T01:00:00-05:00", "dst": "ambiguous-second" },
      { "at": "2026-11-01T07:00:00Z", "local": "2026-11-01T02:00:00-05:00" },
      { "at": "2026-11-01T08:00:00Z", "local": "2026-11-01T03:00:00-05:00" }
    ],
    "notMatching": ["2026-11-01T05:00:00Z"],
    "provenance": { "kind": "derived", "source": "corpus/DERIVATION.md H6" }
  }
]
