[
  { "id": "github-documented-timezone-example-runs-on-weekdays", "dialect": "github-actions", "input": "30 5 * * 1-5", "timezone": "America/New_York",
    "from": "2026-09-21T00:00:00Z", "count": 2,
    "expect": [
      { "at": "2026-09-21T09:30:00Z", "local": "2026-09-21T05:30:00-04:00" },
      { "at": "2026-09-22T09:30:00Z", "local": "2026-09-22T05:30:00-04:00" }
    ],
    "provenance": { "kind": "spec", "source": "corpus/DERIVATION.md G5" } },
  { "id": "github-gap-fixed-time-advances-to-the-next-valid-time", "dialect": "github-actions", "input": "30 2 * * *", "timezone": "America/New_York",
    "from": "2026-03-07T12:00:00Z", "count": 2,
    "expect": [
      { "at": "2026-03-08T07:00:00Z", "local": "2026-03-08T03:00:00-04:00", "dst": "skipped-adjusted", "scheduled": "2026-03-08T02:30:00" },
      { "at": "2026-03-09T06:30:00Z", "local": "2026-03-09T02:30:00-04:00" }
    ],
    "provenance": { "kind": "spec", "source": "corpus/DERIVATION.md G5" } },
  { "id": "github-gap-two-skipped-times-advance-once", "dialect": "github-actions", "input": "0,30 2 * * *", "timezone": "America/New_York",
    "from": "2026-03-07T12:00:00Z", "count": 2,
    "expect": [
      { "at": "2026-03-08T07:00:00Z", "local": "2026-03-08T03:00:00-04:00", "dst": "skipped-adjusted", "scheduled": "2026-03-08T02:00:00" },
      { "at": "2026-03-09T06:00:00Z", "local": "2026-03-09T02:00:00-04:00" }
    ],
    "provenance": { "kind": "assumed", "source": "corpus/DERIVATION.md G5" } },
  { "id": "github-gap-natural-run-is-not-doubled", "dialect": "github-actions", "input": "0 2,3 * * *", "timezone": "America/New_York",
    "from": "2026-03-07T12:00:00Z", "count": 2,
    "expect": [
      { "at": "2026-03-08T07:00:00Z", "local": "2026-03-08T03:00:00-04:00" },
      { "at": "2026-03-09T06:00:00Z", "local": "2026-03-09T02:00:00-04:00" }
    ],
    "provenance": { "kind": "assumed", "source": "corpus/DERIVATION.md G5" } },
  { "id": "github-gap-wildcard-follows-real-time", "dialect": "github-actions", "input": "*/30 * * * *", "timezone": "America/New_York",
    "from": "2026-03-08T06:00:00Z", "count": 3,
    "expect": [
      { "at": "2026-03-08T06:30:00Z", "local": "2026-03-08T01:30:00-05:00" },
      { "at": "2026-03-08T07:00:00Z", "local": "2026-03-08T03:00:00-04:00" },
      { "at": "2026-03-08T07:30:00Z", "local": "2026-03-08T03:30:00-04:00" }
    ],
    "provenance": { "kind": "assumed", "source": "corpus/DERIVATION.md G5" } },
  { "id": "github-overlap-fixed-time-runs-once-on-the-first-pass", "dialect": "github-actions", "input": "30 1 * * *", "timezone": "America/New_York",
    "from": "2026-10-31T12:00:00Z", "count": 2,
    "expect": [
      { "at": "2026-11-01T05:30:00Z", "local": "2026-11-01T01:30:00-04:00", "dst": "ambiguous-first" },
      { "at": "2026-11-02T06:30:00Z", "local": "2026-11-02T01:30:00-05:00" }
    ],
    "notMatching": ["2026-11-01T06:30:00Z"],
    "provenance": { "kind": "assumed", "source": "corpus/DERIVATION.md G5" } },
  { "id": "github-overlap-wildcard-runs-on-both-passes", "dialect": "github-actions", "input": "30 * * * *", "timezone": "America/New_York",
    "from": "2026-11-01T05:00:00Z", "count": 3,
    "expect": [
      { "at": "2026-11-01T05:30:00Z", "local": "2026-11-01T01:30:00-04:00", "dst": "ambiguous-first" },
      { "at": "2026-11-01T06:30:00Z", "local": "2026-11-01T01:30:00-05:00", "dst": "ambiguous-second" },
      { "at": "2026-11-01T07:30:00Z", "local": "2026-11-01T02:30:00-05:00" }
    ],
    "provenance": { "kind": "assumed", "source": "corpus/DERIVATION.md G5" } }
]
