[
  { "id": "aws-documented-last-friday", "dialect": "aws", "input": "cron(15 10 ? * 6L *)", "timezone": "UTC",
    "from": "2026-09-21T00:00:00Z", "count": 3,
    "expect": [
      { "at": "2026-09-25T10:15:00Z", "local": "2026-09-25T10:15:00+00:00" },
      { "at": "2026-10-30T10:15:00Z", "local": "2026-10-30T10:15:00+00:00" },
      { "at": "2026-11-27T10:15:00Z", "local": "2026-11-27T10:15:00+00:00" }
    ],
    "provenance": { "kind": "spec", "source": "corpus/DERIVATION.md A4" } },
  { "id": "aws-documented-second-tuesday", "dialect": "aws", "input": "cron(0 9 ? * 3#2 *)", "timezone": "UTC",
    "from": "2026-09-21T00:00:00Z", "count": 2,
    "expect": [
      { "at": "2026-10-13T09:00:00Z", "local": "2026-10-13T09:00:00+00:00" },
      { "at": "2026-11-10T09:00:00Z", "local": "2026-11-10T09:00:00+00:00" }
    ],
    "provenance": { "kind": "spec", "source": "corpus/DERIVATION.md A4" } },
  { "id": "aws-sunday-is-one", "dialect": "aws", "input": "cron(0 12 ? * 1 *)", "timezone": "UTC",
    "from": "2026-09-21T00:00:00Z", "count": 1,
    "expect": [{ "at": "2026-09-27T12:00:00Z", "local": "2026-09-27T12:00:00+00:00" }],
    "provenance": { "kind": "spec", "source": "corpus/DERIVATION.md A4" } },
  { "id": "aws-year-field-limits-the-runs", "dialect": "aws", "input": "cron(0 0 1 1 ? 2030)", "timezone": "UTC",
    "from": "2026-09-21T00:00:00Z", "count": 2,
    "expect": [{ "at": "2030-01-01T00:00:00Z", "local": "2030-01-01T00:00:00+00:00" }],
    "provenance": { "kind": "spec", "source": "corpus/DERIVATION.md A1" } },
  { "id": "aws-gap-run-is-skipped", "dialect": "aws", "input": "cron(30 2 * * ? *)", "timezone": "America/New_York",
    "from": "2026-03-07T12:00:00Z", "count": 2,
    "expect": [
      { "at": "2026-03-09T06:30:00Z", "local": "2026-03-09T02:30:00-04:00" },
      { "at": "2026-03-10T06:30:00Z", "local": "2026-03-10T02:30:00-04:00" }
    ],
    "notMatching": ["2026-03-08T07:00:00Z"],
    "provenance": { "kind": "spec", "source": "corpus/DERIVATION.md A14" } },
  { "id": "aws-overlap-runs-once-before-the-shift", "dialect": "aws", "input": "cron(30 1 * * ? *)", "timezone": "America/New_York",
    "from": "2026-10-31T12:00:00Z", "count": 2,
    "expect": [
      { "at": "2026-11-01T05:30:00Z", "local": "2026-11-01T01:30:00-04:00", "dst": "ambiguous-first" },
      { "at": "2026-11-02T06:30:00Z", "local": "2026-11-02T01:30:00-05:00" }
    ],
    "notMatching": ["2026-11-01T06:30:00Z"],
    "provenance": { "kind": "spec", "source": "corpus/DERIVATION.md A15" } },
  { "id": "aws-overlap-wildcard-fires-on-the-first-pass-only", "dialect": "aws", "input": "cron(0/30 * * * ? *)", "timezone": "America/New_York",
    "from": "2026-11-01T04:45:00Z", "count": 4,
    "expect": [
      { "at": "2026-11-01T05:00:00Z", "local": "2026-11-01T01:00:00-04:00", "dst": "ambiguous-first" },
      { "at": "2026-11-01T05:30:00Z", "local": "2026-11-01T01:30:00-04:00", "dst": "ambiguous-first" },
      { "at": "2026-11-01T07:00:00Z", "local": "2026-11-01T02:00:00-05:00" },
      { "at": "2026-11-01T07:30:00Z", "local": "2026-11-01T02:30:00-05:00" }
    ],
    "notMatching": ["2026-11-01T06:00:00Z", "2026-11-01T06:30:00Z"],
    "provenance": { "kind": "assumed", "source": "corpus/DERIVATION.md A16" } }
]
