[
  { "id": "kubernetes-gap-fixed-time-is-skipped", "dialect": "kubernetes", "input": "30 2 * * *", "timezone": "America/New_York",
    "from": "2026-03-07T12:00:00Z", "count": 2,
    "expect": [
      { "at": "2026-03-09T06:30:00Z", "local": "2026-03-09T02:30:00-04:00" },
      { "at": "2026-03-10T06:30:00Z", "local": "2026-03-10T02:30:00-04:00" }
    ],
    "notMatching": ["2026-03-08T07:00:00Z", "2026-03-08T07:30:00Z"],
    "provenance": { "kind": "derived", "source": "corpus/DERIVATION.md K11" } },
  { "id": "kubernetes-gap-wildcard-loses-only-the-skipped-times", "dialect": "kubernetes", "input": "30 * * * *", "timezone": "America/New_York",
    "from": "2026-03-08T06:00:00Z", "count": 3,
    "expect": [
      { "at": "2026-03-08T06:30:00Z", "local": "2026-03-08T01:30:00-05:00" },
      { "at": "2026-03-08T07:30:00Z", "local": "2026-03-08T03:30:00-04:00" },
      { "at": "2026-03-08T08:30:00Z", "local": "2026-03-08T04:30:00-04:00" }
    ],
    "provenance": { "kind": "derived", "source": "corpus/DERIVATION.md K12" } },
  { "id": "kubernetes-overlap-fixed-time-runs-twice", "dialect": "kubernetes", "input": "30 1 * * *", "timezone": "America/New_York",
    "from": "2026-10-31T12:00:00Z", "count": 3,
    "expect": [
      { "at": "2026-11-01T05:30:00Z", "local": "2026-11-01T01:30:00-04:00", "dst": "ambiguous-first" },
      { "at": "2026-11-01T06:30:00Z", "local": "2026-11-01T01:30:00-05:00", "dst": "ambiguous-second" },
      { "at": "2026-11-02T06:30:00Z", "local": "2026-11-02T01:30:00-05:00" }
    ],
    "provenance": { "kind": "derived", "source": "corpus/DERIVATION.md K13" } },
  { "id": "kubernetes-midnight-overlap-runs-the-daily-job-twice", "dialect": "kubernetes", "input": "0 0 * * *", "timezone": "America/Havana",
    "from": "2026-10-31T12:00:00Z", "count": 3,
    "expect": [
      { "at": "2026-11-01T04:00:00Z", "local": "2026-11-01T00:00:00-04:00", "dst": "ambiguous-first" },
      { "at": "2026-11-01T05:00:00Z", "local": "2026-11-01T00:00:00-05:00", "dst": "ambiguous-second" },
      { "at": "2026-11-02T05:00:00Z", "local": "2026-11-02T00:00:00-05:00" }
    ],
    "provenance": { "kind": "derived", "source": "corpus/DERIVATION.md K14" } },
  { "id": "kubernetes-stepped-star-day-of-month-is-or", "dialect": "kubernetes", "input": "0 0 */2 * 1", "timezone": "UTC",
    "from": "2026-09-21T00:00:00Z", "count": 4,
    "expect": [
      { "at": "2026-09-23T00:00:00Z", "local": "2026-09-23T00:00:00+00:00" },
      { "at": "2026-09-25T00:00:00Z", "local": "2026-09-25T00:00:00+00:00" },
      { "at": "2026-09-27T00:00:00Z", "local": "2026-09-27T00:00:00+00:00" },
      { "at": "2026-09-28T00:00:00Z", "local": "2026-09-28T00:00:00+00:00" }
    ],
    "provenance": { "kind": "derived", "source": "corpus/DERIVATION.md K10" } },
  { "id": "kubernetes-star-inside-a-list-is-and", "dialect": "kubernetes", "input": "0 0 5,* * 1", "timezone": "UTC",
    "from": "2026-09-21T00:00:00Z", "count": 2,
    "expect": [
      { "at": "2026-09-28T00:00:00Z", "local": "2026-09-28T00:00:00+00:00" },
      { "at": "2026-10-05T00:00:00Z", "local": "2026-10-05T00:00:00+00:00" }
    ],
    "provenance": { "kind": "derived", "source": "corpus/DERIVATION.md K10" } }
]
